[
  {
    "name": "Alice Johnson",
    "age": 30,
    "email": "alice@example.com",
    "subjects": [ "Math", "Physics" ]
  },
  {
    "name": "Bob Smith",
    "age": 22,
    "email": "bob@example.com",
    "subjects": [ "History" ]
  },
  {
    "name": "Charlie Brown",
    "age": 35,
    "email": "charlie@example.com",
    "subjects": [ "Biology", "Chemistry" ]
  }
]